{
  "event_id": "EVT-B2C3D4E5-20260530211500",
  "event_type": "ci.run.completed",
  "ts": "2026-05-30T21:15:00Z",
  "source": "poll-ci-runs",
  "repo": "MyAiDevs/livemask-backend",
  "priority": "normal",
  "ci": {
    "run_id": 26685074842,
    "head_sha": "f8357c09901629eed55c39bcdc225bdc8129026c",
    "workflow_name": "Staging Smoke",
    "status": "completed",
    "conclusion": "success",
    "url": "https://github.com/MyAiDevs/livemask-ci-cd/actions/runs/26685074842",
    "created_at": "2026-05-30T21:00:00Z"
  }
}
