{
  "event_id": "EVT-A1B2C3D4-20260530210000",
  "event_type": "comment.created",
  "ts": "2026-05-30T21:00:00Z",
  "source": "poll-fixed-control-issues",
  "repo": "MyAiDevs/livemask-ci-cd",
  "priority": "high",
  "comment": {
    "issue_number": 14,
    "comment_id": 4582965630,
    "comment_body": "ACTION_NEEDED: Claude must verify the remote runtime freshness before reporting complete.",
    "body_length": 85,
    "author": "sammytan",
    "cursor_key": "MyAiDevs/livemask-ci-cd/14/4582965630",
    "keywords_matched": ["ACTION_NEEDED"]
  }
}
